PMID,Title,Authors,Citation,First Author,Journal/Book,Publication Year,Create Date,PMCID,NIHMS ID,DOI
"31796739","Author Correction: Gastroesophageal reflux GWAS identifies risk loci that also associate with subsequent severe esophageal diseases","An J, Gharahkhani P, Law MH, Ong JS, Han X, Olsen CM, Neale RE, Lai J, Vaughan TL, Gockel I, Thieme R, Böhmer AC, Jankowski J, Fitzgerald RC, Schumacher J, Palles C; BEACON; 23andMe Research Team; Whiteman DC, MacGregor S.","Nat Commun. 2019 Dec 4;10(1):5617. doi: 10.1038/s41467-019-13526-2.","An J","Nat Commun","2019","2019/12/05","PMC6890747","","10.1038/s41467-019-13526-2"
"33767169","Author Correction: Genome-wide association study of depression phenotypes in UK Biobank identifies variants in excitatory synaptic pathways","Howard DM, Adams MJ, Shirali M, Clarke TK, Marioni RE, Davies G, Coleman JRI, Alloza C, Shen X, Barbu MC, Wigmore EM, Gibson J; 23andMe Research Team; Hagenaars SP, Lewis CM, Ward J, Smith DJ, Sullivan PF, Haley CS, Breen G, Deary IJ, McIntosh AM.","Nat Commun. 2021 Mar 25;12(1):2012. doi: 10.1038/s41467-021-22411-w.","Howard DM","Nat Commun","2021","2021/03/26","PMC7994308","","10.1038/s41467-021-22411-w"
"32218487","Author Correction: Genome-wide association study of knee pain identifies associations with GDF5 and COL27A1 in UK Biobank","Meng W, Adams MJ, Palmer CNA; 23andMe Research Team; Shi J, Auton A, Ryan KA, Jordan JM, Mitchell BD, Jackson RD, Yau MS, McIntosh AM, Smith BH.","Commun Biol. 2020 Mar 26;3(1):149. doi: 10.1038/s42003-020-0880-x.","Meng W","Commun Biol","2020","2020/03/29","PMC7098975","","10.1038/s42003-020-0880-x"
"30197049","Association of Whole-Genome and NETRIN1 Signaling Pathway-Derived Polygenic Risk Scores for Major Depressive Disorder and White Matter Microstructure in the UK Biobank","Barbu MC, Zeng Y, Shen X, Cox SR, Clarke TK, Gibson J, Adams MJ, Johnstone M, Haley CS, Lawrie SM, Deary IJ; Major Depressive Disorder Working Group of the Psychiatric Genomics Consortium; 23andMe Research Team; McIntosh AM, Whalley HC.","Biol Psychiatry Cogn Neurosci Neuroimaging. 2019 Jan;4(1):91-100. doi: 10.1016/j.bpsc.2018.07.006. Epub 2018 Jul 31.","Barbu MC","Biol Psychiatry Cogn Neurosci Neuroimaging","2019","2018/09/11","PMC6374980","","10.1016/j.bpsc.2018.07.006"
"30937360","The Parkinson's phenome-traits associated with Parkinson's disease in a broadly phenotyped cohort","Heilbron K, Noyce AJ, Fontanillas P, Alipanahi B, Nalls MA; 23andMe Research Team; Cannon P.","NPJ Parkinsons Dis. 2019 Mar 27;5:4. doi: 10.1038/s41531-019-0077-5. eCollection 2019.","Heilbron K","NPJ Parkinsons Dis","2019","2019/04/03","PMC6437217","","10.1038/s41531-019-0077-5"
"21062826","Ultraconserved cDNA segments in the human transcriptome exhibit resistance to folding and implicate function in translation and alternative splicing","Sathirapongsasuti JF, Sathira N, Suzuki Y, Huttenhower C, Sugano S.","Nucleic Acids Res. 2011 Mar;39(6):1967-79. doi: 10.1093/nar/gkq949. Epub 2010 Nov 9.","Sathirapongsasuti JF","Nucleic Acids Res","2011","2010/11/11","PMC3064809","","10.1093/nar/gkq949"
"22373075","Propensity score analysis in the Genetic Analysis Workshop 17 simulated data set on independent individuals","Lin CM, Sathirapongsasuti FJ, Kerner B.","BMC Proc. 2011 Nov 29;5 Suppl 9(Suppl 9):S71. doi: 10.1186/1753-6561-5-S9-S71.","Lin CM","BMC Proc","2011","2012/03/01","PMC3287911","","10.1186/1753-6561-5-S9-S71"
